<?xml version="1.0" encoding="UTF-8"?>
<handlers elem_name="BRN2LinkStat" xmlns:xsi="http://www.w3.org/2001/XMLSchema-instance" 
		xsi:noNamespaceSchemaLocation="platform:/plugin/de.hub.clickwatch.core.test/resources/link_stat.xsd">
	<handler name="bcast_stats">
		<entry from="06-0F-B5-97-36-D8" time="1297865583.873778100" seq="616" period="2000" tau="100000">
			<link to="06-0F-B5-97-36-54" seq="616" period="2000" tau="100000" last_rx="0.569037100">
				<link_info size="200" rate="2" fwd="94" rev="92"/>
				<link_info size="500" rate="12" fwd="54" rev="42"/>
			</link>
			<link to="06-0F-B5-97-37-FC" seq="617" period="2000" tau="100000" last_rx="0.974657100">
				<link_info size="500" rate="2" fwd="98" rev="100"/>
				<link_info size="400" rate="4" fwd="78" rev="90"/>
			</link>
		</entry>
	</handler>
	<handler name="bad_version">
		<badnodes id="06-11-6B-60-48-A5" time="1297866403.933551985">
			<badnode id="06-0F-B5-97-36-D8" version="101"/>
			<badnode id="06-0F-B5-97-36-DE" version="102"/>
		</badnodes>
	</handler>
	<handler name="tau">
		<tau value="100000"/>
	</handler>
	<handler name="period">
		<period value="2000"/>
	</handler>
	<handler name="probes">
		<probes id="06-11-6B-60-48-A5" time="1297866479.271011241">
			<probe rate="2" size="500"/>
			<probe rate="4" size="400"/>
			<probe rate="12" size="500"/>
		</probes>
	</handler>
</handlers>